{
  "capability_ladder": [
    {
      "adds_only": "frozen_schedule",
      "controller_contract": "Replay one predeclared strategy instance without outcome-conditioned switching.",
      "estimand": "static_lower_bound",
      "id": "IA0_static_frozen",
      "knowledge_and_authority_orthogonal": true,
      "matched_against": null
    },
    {
      "adds_only": "strategy_library_selection",
      "controller_contract": "Select and parameterize one frozen strategy card before the first window.",
      "estimand": "IA1_minus_IA0",
      "id": "IA1_library_open_loop",
      "knowledge_and_authority_orthogonal": true,
      "matched_against": "IA0_static_frozen"
    },
    {
      "adds_only": "deterministic_feedback_switching",
      "controller_contract": "Use a frozen rule table over delayed typed observations; no learning.",
      "estimand": "IA2_minus_IA1",
      "id": "IA2_rule_interactive",
      "knowledge_and_authority_orthogonal": true,
      "matched_against": "IA1_library_open_loop"
    },
    {
      "adds_only": "algorithmic_credit_assignment",
      "controller_contract": "Use deterministic bandit, Bayesian, or evolutionary adaptation over the shared surface.",
      "estimand": "IA3_minus_IA2",
      "id": "IA3_nonllm_adaptive",
      "knowledge_and_authority_orthogonal": true,
      "matched_against": "IA2_rule_interactive"
    },
    {
      "adds_only": "llm_strategy_and_tool_orchestration",
      "controller_contract": "Replace only the IA3 decision core with an LLM emitting externally validated typed plans.",
      "estimand": "IA4_minus_IA3",
      "id": "IA4_llm_orchestrator",
      "knowledge_and_authority_orthogonal": true,
      "matched_against": "IA3_nonllm_adaptive"
    },
    {
      "adds_only": "bounded_critique_and_revision",
      "controller_contract": "Add one critique-and-revision step without another environment observation.",
      "estimand": "IA5_minus_IA4_compute_matched",
      "id": "IA5_llm_planner_critic",
      "knowledge_and_authority_orthogonal": true,
      "matched_against": "IA4_compute_matched"
    }
  ],
  "detector_defense_contracts": {
    "defenses": [
      {
        "action": "passive_observation",
        "id": "M0_alarm_only",
        "operational_cost_required": true,
        "role": "separate detection from mitigation"
      },
      {
        "action": "reject_or_project_unsafe_commands",
        "id": "M1_safe_command_screen",
        "operational_cost_required": true,
        "role": "preventive intent-aware control"
      },
      {
        "action": "revert_to_frozen_safe_local_mode",
        "id": "M2_local_autonomous_fallback",
        "operational_cost_required": true,
        "role": "limit remote-authority abuse"
      },
      {
        "action": "bounded_private_excitation",
        "id": "M3_physics_aware_watermark",
        "operational_cost_required": true,
        "role": "active stealth-attack detection"
      },
      {
        "action": "bounded_model_changing_response",
        "id": "M4_event_triggered_mtd",
        "operational_cost_required": true,
        "role": "cost-aware active defense"
      }
    ],
    "detectors": [
      {
        "detects": "invalid_or_policy_violating_commands",
        "id": "D0_envelope_policy",
        "inputs": "command_and_device_limits",
        "known_gap": "within-envelope harmful commands",
        "threshold_source": "M18_preliminary_only_or_later"
      },
      {
        "detects": "physics residual inconsistency",
        "id": "D1_physics_residual_vsct",
        "inputs": "network_measurements_and_sensitivity",
        "known_gap": "physically consistent authority abuse",
        "threshold_source": "M18_preliminary_only_or_later"
      },
      {
        "detects": "persistent small shifts",
        "id": "D2_sequential_cusum",
        "inputs": "calibrated_innovation_stream",
        "known_gap": "operating-point drift false alarms",
        "threshold_source": "M18_preliminary_only_or_later"
      },
      {
        "detects": "cross-layer inconsistency and authority abuse",
        "id": "D3_cross_layer_intent_response",
        "inputs": "intent_delivery_acceptance_realized_PQ_response",
        "known_gap": "untrusted lineage",
        "threshold_source": "M18_preliminary_only_or_later"
      },
      {
        "detects": "complementary system and local anomalies",
        "id": "D4_hybrid_central_local_ae",
        "inputs": "central_residual_and_local_DER_features",
        "known_gap": "adaptive reconstruction evasion",
        "threshold_source": "M18_preliminary_only_or_later"
      },
      {
        "detects": "ramp and stateful temporal deviation",
        "id": "D5_temporal_state_prediction",
        "inputs": "multivariate_time_series_and_optional_topology",
        "known_gap": "compute and topology shift",
        "threshold_source": "M18_preliminary_only_or_later"
      },
      {
        "detects": "phase-aware spatial anomalies",
        "id": "D6_graph_localization",
        "inputs": "topology_and_multivariate_history",
        "known_gap": "feeder-transfer uncertainty",
        "threshold_source": "M18_preliminary_only_or_later"
      },
      {
        "detects": "complementary detection evidence",
        "id": "DF_transparent_fusion",
        "inputs": "frozen_member_scores_and_alarms",
        "known_gap": "trajectory false-alarm inflation",
        "threshold_source": "M18_preliminary_only_or_later"
      }
    ]
  },
  "estimable_contrasts": [
    "IA1_minus_IA0_strategy_library_value",
    "IA2_minus_IA1_feedback_switching_value",
    "IA3_minus_IA2_algorithmic_adaptation_value",
    "IA4_minus_IA3_LLM_orchestration_value",
    "IA5_minus_IA4_compute_matched_critique_value",
    "K1_minus_K0_delayed_feedback_value",
    "K2_minus_K1_gray_box_information_value",
    "K3_minus_K2_white_box_information_value",
    "mechanism_minus_matched_control",
    "defense_aware_minus_defense_unaware_under_equal_K",
    "mitigation_minus_alarm_only_with_operational_cost"
  ],
  "executable": false,
  "governance": {
    "M14_review_machinery_preserved_as_dormant_provenance": true,
    "M17_may_assign_sources_partitions_resources_or_thresholds": false,
    "M17_may_execute_trials": false,
    "M18_gate_required_before_any_preliminary_runtime_action": true,
    "all_preliminary_outputs_must_be_labeled_PRELIMINARY_ONLY": true,
    "final_evaluation_and_confirmatory_campaign_sealed": true,
    "post_preliminary_external_consultation_required_before_final_freeze": true,
    "preliminary_first_authorized_in_RKA": true
  },
  "hard_stops": [
    "cross_track_pooling_between_CAREER_core_and_red_team_extension",
    "evaluation_partition_or_seed_access",
    "final_threshold_or_resource_lock",
    "hidden_detector_score_or_oracle_information",
    "knowledge_authority_budget_or_interface_mismatch",
    "silent_failed_run_refusal_timeout_or_invalid_action_removal",
    "silent_simulation_time_advance_or_unpriced_tool_side_effect",
    "unchecked_LLM_text_to_actuator_path",
    "unregistered_source_partition_threshold_detector_or_runtime_resource"
  ],
  "input_assets": [
    {
      "bytes": 11540,
      "path": "v3/g7_confirmatory/M8_CAREER_STEALTH_BIAS_DESIGN.md",
      "sha256": "98397028c636be788e8a8d168193d562f8a2c2e39cf3d9f7ab46608dadfda6ad"
    },
    {
      "bytes": 8094,
      "path": "v3/g7_confirmatory/RED_TEAM_DESIGN.md",
      "sha256": "155e5b9240555c741005df84dd5b4642ca5fe9ad2a9f1757391585621dae5607"
    },
    {
      "bytes": 7306,
      "path": "v3/g7_confirmatory/artifacts/ai_v2_component_matrix.json",
      "sha256": "19ac61d36fbc31993739cf45a670951867d08561d8a3dfebae255d8344785559"
    },
    {
      "bytes": 69675,
      "path": "v3/g7_confirmatory/roadmap_2026/roadmap_blueprint.json",
      "sha256": "59a2878f407e2b559a4a1cc21cd2d5f971e6a35e481dcc448c4f4a18e72430b5"
    },
    {
      "bytes": 7524,
      "path": "v3/g7_confirmatory/M16_CAREER_INTERNAL_ADVISORY_REPORT.md",
      "sha256": "06737faa61376028f9e0fb398eb7cb7f473bbaee5bfcd8865af379c1162c8bd2"
    },
    {
      "bytes": 17678,
      "path": "v3/g7_confirmatory/artifacts/career_internal_advisory_m16.json",
      "sha256": "679462039a5e2b811cf676d69d840b9101a0a8e37e2d9cd61062faae69d8f82f"
    }
  ],
  "knowledge_contract": {
    "axes": [
      "grid",
      "detector",
      "training_data",
      "defense",
      "feedback"
    ],
    "levels": [
      "none",
      "partial",
      "exact"
    ],
    "profiles": [
      {
        "K": {
          "defense": "none",
          "detector": "none",
          "feedback": "none",
          "grid": "partial",
          "training_data": "none"
        },
        "exposure": "public_device_interface_and_bounds_only",
        "id": "K0_black_no_feedback",
        "label": "black_box_zero_feedback"
      },
      {
        "K": {
          "defense": "none",
          "detector": "none",
          "feedback": "partial",
          "grid": "partial",
          "training_data": "none"
        },
        "exposure": "typed_telemetry_plus_delayed_binary_success_or_alarm",
        "id": "K1_black_delayed_binary",
        "label": "black_box_delayed_feedback"
      },
      {
        "K": {
          "defense": "partial",
          "detector": "partial",
          "feedback": "partial",
          "grid": "partial",
          "training_data": "partial"
        },
        "exposure": "approximate_topology_detector_family_and_bounded_probe_history",
        "id": "K2_gray_balanced",
        "label": "gray_box"
      },
      {
        "K": {
          "defense": "exact",
          "detector": "exact",
          "feedback": "exact",
          "grid": "exact",
          "training_data": "exact"
        },
        "exposure": "frozen_exact_bytes_parameters_state_and_declared_training_distribution",
        "id": "K3_white_exact",
        "label": "white_box"
      }
    ],